No	Chapter	Point	Question_JP	Question_EN	Answer	Choices1	Choices2	Choices3	Choices4	Type	Source
341	14	91	優雅な文体を持っているという点で、彼は優れた作家だ。	He is a good writer ( ) he has an elegant style.	in that	that	in which	if that	in that	4択	<松山大>
342	14	92	それを終えたときには、すぐに私に知らせてください。	Let me know at once ( ) you have finished it.	when	when	until	for	so that	4択	<中京大>
343	14	92	リッチがニュージーランドから戻って以来、 私は彼に会っていない。	I haven't seen Rich ( ) he returned from New Zealand.	since	as	since	when	until	4択	<東海大>
344	14	92	この前テニスをしてから、ずいぶんと久しい。	It's been ages ( ).	since I last played tennis	since I last played tennis	that I haven't played tennis	after I didn't play tennis	that I don't play tennis	4択	<名古屋工大>
345	14	92	忘れないうちに、それを書きとめておいた方がいいよ。	You had better write it down ( ) you forget it.	before	after	before	whether	while	4択	<京都学園大>
347	14	92	私がジョンに初めて会ったとき、彼はまだ大学生でした。	( ) I met John, he was still a college student.	The first time	At first	For the first time	In the first	The first time	4択	<聖学院大>
348	14	92	この激しい吹雪が収まるまで列車の運行はないでしょう。	There won't be any train service ( ) this terrible snowstorm is over.	until	by the time	while	since	until	4択	<法政大>
349	14	92	あなたが50歳になるまでには、世界は大きく変わっているでしょう。	( ) you are fifty, the world will have greatly changed.	By the time	Until	Since	By the time	While	4択	<横浜市立大>
350	14	92	彼女はいつも嫌だと言っていたが、最後の最後に、突然私たちを連れていくことに同意した。	She said no every time, ( ) at the last moment she suddenly agreed to take us.	until	until	by	during	where	4択	<亜細亜大>
352	14	93	私はその知らせを聞くとすぐに、 その家を離れた。	I left the house ( ) I heard the news.	as soon as	as soon as	during	until	while	4択	<早稲田大>
353	14	93	建物を出たとたんに一人の警察官にいくつかの職務質問をされた。	(a) I had hardly left the building when I was asked some questions by a police officer. (b) The (moment) I left the building, I was asked some questions by a police officer.	moment	instance	moment	time	sooner	4択書換	<駒澤大>
355	14	93	その言葉を口にすると、私はすぐに後悔した。	I had no sooner uttered the words ( ) I regretted them.	than	that	than	if	as	4択	<佛教大>
356	14	93	彼が部屋に入ったとたん、 彼らは笑いをやめた。	( ) he entered the room when they stopped laughing.	Hardly had	Hardly had	Had hardly	On having	Having had	4択	<松山大>
357	14	94	私たちは他の誰からも援助を期待できないのだから、 最善を尽くすように努力しよう。	Let's try to do our best, ( ) we can expect no help from anyone else.	since	since	unless	that	what	4択	<桃山学院大>
358	14	94	ほとんどあなただとはわからなかった。 というのも、ずいぶんと変わってしまっていたから。	I hardly recognized you, ( ) you've changed so much.	for	because	for	even if	although	4択	<湘南工科大>
359	14	94	人はたくさんのことを知っているからといって偉いわけではない。	A man is not great ( ) he knows many things.	because	for	as	because	since	4択	<実践女子大>
360	14	95	適切な時期に種をまかなければ、豊かな収穫は見込めない。	( ) you sow at the right time, you cannot expect a rich harvest.	Unless	Whenever	If	Unless	Wherever	4択	<西南学院大>
361	14	95	彼が間違いを認めれば、私は彼を許しましょう。	I will forgive him ( ) he acknowledges his mistakes.	provided	provided	otherwise	nevertheless	however	4択	<青山学院大>
362	14	95	6か月以内に返すという条件で、 君にお金を貸しましょう。	I'll lend you the money ( ) condition that you return it within six months.	on	with	for	in	on	4択	<玉川大>
363	14	95	彼女はまるで女王であるかのように振る舞う。	She behaves ( ) she were a queen.	as if	although	because	so that	as if	4択	<和洋女子大>
364	14	96	彼は、かなりの間日本に住んでいるけれども、 日本語をあまりうまく話せない。	( ) he has lived in Japan for some time, he cannot speak Japanese very well.	Although	Although	Even	However	Nevertheless	4択	<駿河台大>
365	14	96	明日たとえ雨が降っても、音楽祭は予定通り行われます。	( ) it rains tomorrow, the music festival will take place as planned.	Even if	Although	Even if	During	Because	4択	<甲南大>
366	14	96	暗かったけれども、私たちはなんとか帰ることができた。	Dark ( ) it was, we found our way back.	as	as	if	that	while	4択	<中部大>
367	14	96	皆さんは好むと好まざるとにかかわらず、ご両親とそこに行かなければなりません。	You must go there with your parents, ( ) you like it or not.	whether	when	though	whether	as	4択	<名城大>
368	14	97	スープはとても熱くて舌をやけどするところだった。	The soup was ( ) hot that I almost burned my tongue.	so	such	much	very	so	4択	<芝浦工大>
369	14	97	最悪の日だったので、私たちは行かないことを決めた。	It was ( ) a terrible day that we decided not to go.	such	very	so	specially	such	4択	<拓殖大>
370	14	97	教授の自尊心は非常に強かったので、彼女はその侮辱を無視することができなかった。	( ) was the professor's pride that she could not ignore the insult.	Such	So	Such	Small	Little	4択	<摂南大>
374	14	98	雨は降らないと思うけれど、降るといけないから傘を持っていきます。	I don't think it'll rain, but I'll take an umbrella ( ) it does.	in case	as if	even though	in case	now that	4択	<関東学院大>
376	14	99	いったんゲームの基本的なルールを身につけてしまえば、あなたはきっとそのゲームを大いに楽しめるでしょう。	( ) you learn the basic rules of the game, I'm sure you'll enjoy it a lot.	Once	Although	While	Once	Therefore	4択	<東京造形大>
377	14	100	私の知る限り、すべての野生動物はいつも体をきれいにしています。	As ( ) as I know, all wild animals keep themselves clean.	far	far	long	possible	well	4択	<甲南大>
378	14	100	毎日散歩に連れていくことを条件に、 私たちは娘に犬を買ってあげることを承諾した。	We agreed to buy my daughter a dog ( ) she takes it for a walk every day.	as long as	while	otherwise	unless	as long as	4択	<成蹊大>
379	15	101	レールの工事が続いている間、列車は運行を休止している。	The train is out of service ( ) the rail construction is going on.	while	with	while	after	during	4択	<玉川大>
380	15	101	インターネットは一時的な流行であると言う人たちがいる一方で、それが人類の歴史における転換点であると信じている人たちもいる。	Some people say that the Internet is a passing fashion, ( ) others believe it is a turning point in human history.	while	during	while	judging from	considering	4択	<国立看護大学校>
381	15	101	あなたの境遇は気の毒に思いますけれども、私はあなたを助けることはできません。	( ) I sympathize with you in your situation, I can't help you.	While	While	Whether	Whichever	Since	4択	<佛教大>
382	15	102	山に登っていくにつれて、空気はますます薄くなってきた。	( ) we went up the mountain, the air became thinner.	As	As	During	When	Since	4択	<成城大>
383	15	102	郷に入りては郷に従え。	Do in Rome ( ) the Romans do.	as	where	while	as	according to	4択	<中京大>
384	15	102	私の書き物テーブルには触らないで。 そのままにしておいてくれ。	Don't touch my writing-table; leave it ( ) it is.	as	when	if	that	as	4択	<中央大>
386	15	103	次回の委員会は1月7日に開催されます。	The next committee meeting will be held ( ) the 7th of January.	on	at	of	on	in	4択	<北里大>
387	15	103	7日の午前中に、彼はロンドンに向かって出発した。	He started for London ( ) the morning of the seventh.	on	in	on	to	at	4択	<桃山学院大>
388	15	103	私は、車を銀行のある角に止めた。	I parked my car ( ) the corner where the bank is.	at	upon	into	at	for	4択	<駒澤大>
389	15	103	テッド・カーソンは1944年8月7日午前10時30分にニューヨークで生まれた。	Ted Carson was born ( ) at 10:30 in the morning.	in New York on August 7, 1944	on New York by August 7, 1944	in New York in August 7, 1944	in New York on August 7, 1944	on New York at August 7, 1944	4択	<清泉女子大>
390	15	104	今から出かけて1時間ほどで戻ってきます。	I will go now and will be back ( ) about an hour.	in	with	in	by	on	4択	<九州産業大>
391	15	104	フレッドは私の10年来の友だちです。	Fred is a friend I've known ( ) ten years.	for	since	of	during	for	4択	<日本大>
393	15	104	「どのくらい待った?」「6時までだよ」	How long did you wait? "( ) six o'clock."	Until	For	On	Until	By	4択	<聖学院大>
394	15	104	授業が終わるまでに、 その作文を書き終えてください。	Please finish the essay ( ) the end of the class.	by	by	during	until	while	4択	<早稲田大>
395	15	104	今回の降雪は、ここ20年で最もすごい。	This is the heaviest snowfall ( ) twenty years.	in	after	at	in	on	4択	<和洋女子大>
396	15	105	森の上には満月が出ていた。	There was a full moon ( ) the forest.	above	into	on	above	out	4択	<立命館大>
397	15	105	彼女は、自分の部屋の壁にたくさんのポスターを貼っているところだ。	She is putting a lot of posters ( ) the walls of her room.	on	at	by	in	on	4択	<近畿大>
398	15	105	先週末、私は蔵王山にスキーに行った。	I went skiing ( ) Mt. Zao last weekend.	at	until	at	to	for	4択	<拓殖大>
399	15	106	その土地は、1エーカー単位でのみ売られるだろう。	The land will be sold only ( ).	by the acre	for an acre	to acres	in acre	by the acre	4択	<上智大>
402	15	106	口に食べ物をいっぱい入れたまま話してはいけません。	Don't talk ( ) your mouth full.	with	during	with	when	over	4択	<関東学院大>
405	15	106	その壁はとても低かったので、彼らは簡単に跳び越すことができた。	The wall was so low that they could jump over it ( ).	with ease	in ease	to ease	of ease	with ease	4択	<九州産大>
406	15	106	赤いトレーニングスーツを着たあの少女は、 毎朝トラックを走っている。	That girl ( ) the red sweat suit runs around the track every morning.	in	at	for	in	to	4択	<京都学園大>
407	15	106	お茶を飲みながら話しませんか。	Let's talk ( ) a cup of tea, shall we?	over	in	at	on	over	4択	<東海大>
408	15	106	1月半ばのわりにはとても天気が穏やかです。	It is very mild ( ) the middle of January.	for	for	with	on	of	4択	<関西外大>
409	15	106	サリーは年齢のわりにはかなり背が高い。	Sally is rather tall ( ) her age.	for	at	of	to	for	4択	<獨協大>
410	15	106	驚いたことに、 彼女は彼らの結婚パーティーにやって来なかった。	( ) my surprise, she didn't come to their wedding party.	To	At	By	To	With	4択	<東京理大>
411	15	106	すべての人が満足するように、裁判官は最終的にすべてのことを解決した。	The judge finally settled everything ( ) everyone's satisfaction.	to	with	from	in	to	4択	<中央大>
412	15	106	彼には、アランの他にあと2人子どもがいます。	He has two other children ( ) Alan.	besides	besides	except	without	on	4択	<立命館大>
413	15	106	日曜日以外ならいつでも私を訪ねてきてください。 毎週日曜日は教会に行きます。	You could visit me any day ( ) Sunday. I go to church every Sunday.	but	of	with	on	but	4択	<名城大>
414	15	106	あいにくオフィスにペンを忘れた。 何か書くものを持っていますか。	I'm afraid I left my pen in my office. Do you have something to write ( )?	with	by	to	with	for	4択	<青山学院大>
415	15	106	残念ながら、当社には家具付きアパートの空室はありません。	Unfortunately, we do not have any apartments available ( ) furniture.	with	at	in	on	with	4択	<立命館大>
416	15	106	この数学の問題がわかりません。 それは私の能力を超えています。	I can't understand this mathematics problem; it is ( ) me.	beyond	ahead	beyond	up to	all over	4択	<南山大>
417	15	106	日没の美しさは、 言葉では表せないほどだった。	The beauty of the sunset was ( ) description.	beyond	over	beyond	above	across	4択	<清泉女子大>
418	15	106	最初のころのつらい困難事にもかかわらず、彼らは結局、結婚した。	( ) their severe early troubles, they ended up getting married.	Despite	Because of	Despite	Due to	By way of	4択	<青山学院大>
419	15	106	私が理解できたことから判断すると、彼らは政府に非を認めさせた。	( ) what I could understand, they convinced the government to back down.	From	By	As far as	About	From	4択	<立命館大>
420	15	106	このカフェは有名で観光客はもとより地元住民の間でも人気がある。	This is the café famous and popular ( ) local residents as well as visitors.	among	for	among	in	to	4択	<日本大>
422	15	106	私のかかりつけの医者はいつも教師が子どもに話すように私に話す。	My doctor always talks to me ( ) a teacher talking to a child.	like	like	resemble	same	similar	4択	<東京理科大>
423	15	106	あの教授は日本で最も著名な科学者だと思われている。	That professor is considered ( ) the most notable scientist in Japan.	as	for	as	from	to	4択	<亜細亜大>
424	15	106	電車内の優先席近くでは、携帯電話で話すことはひかえてください。	Please refrain from talking ( ) the mobile phone near the priority seats in the train.	on	by	on	at	in	4択	<桜美林大>
425	15	106	警官が私の腕をつかんだ。	A policeman caught me ( ) arm.	by the	with an	by the	by an	with the	4択	<流通経大>
426	15	106	彼女は私の顔を見つめた。	She looked me ( ).	in the face	by a face	by the face	in a face	in the face	4択	<北海学園大>
428	16	107	両親も兄 [弟] もここにいません。	Neither my parents nor my brother ( ) here.	is	is	are not	is not	were not	4択	<摂南大>
430	16	107	私だけでなくあなたも間違っている。	You as well as I ( ) in the wrong.	are	was	am	are	in the wrong	4択	<摂南大>
432	16	109	私の家の近くにきれいな川があることをほとんどの人が知らない。	Most people do not know ( ) beautiful rivers near my house.	there are	there is	there are	it is	they are	4択	<熊本県立大>
433	16	109	この地域には雪がたくさん降ります。	There ( ) a lot of snow in this area.	is	is	are	has	have	4択	<駒澤大>
434	16	110	参加者の人数は私たちが予想したよりもずっと少なかった。	The number of the participants ( ) much smaller than we had expected.	was	has	have	was	were	4択	<近畿大>
436	16	111	数学は、アメリカの高等学校では必須科目である。	Mathematics ( ) a compulsory subject in American high schools.	is	have	are	is	has	4択	<北里大>
438	16	111	5か月というのは、その計画を実行するのに短すぎる時間だ。	Five months ( ) time to carry out the plan.	is too short a	are too a short	are too short a	is too short a	is too a short	4択	<日本工大>
441	16	113	なぜあなたがそれを自分でしなければならなかったのか、私にはわからない。	I don't understand ( ) you had to do it yourself.	why	what	which	who	why	4択	<東京経大>
442	16	113	その計画にどのくらい費用がかかるのかを言うのは難しい。	It is difficult to say ( ) the plan would cost.	how much	how many expenses	how much	no matter what	whatever	4択	<関西学院大>
443	16	113	「どのくらい外で食事をするの?」「1か月に2回だね」	( ) do you eat out? "Twice a month."	How often	What time	Where	How often	How come	4択	(記載なし)
444	16	113	オックスフォード大学に着くまで、どのくらいかかりますか。	How ( ) does it take to get to Oxford University?	long	much	long	far	many	4択	<大阪産大>
445	16	113	私たちは今晩は外で食事をするつもりです。 あとどれくらいでレポートを仕上げることができますか。	We are supposed to go out for dinner tonight. How ( ) can you finish the report?	soon	soon	long	much	often	4択	<東京電機大>
446	16	114	私は、彼女がどうやってその問題を解いたのか知りたかった。	I wanted to know ( ) the problem.	how she solved	how she could be solved	how she solved	how could she solve	how did she solve	4択	<立正大>
447	16	114	あなたの新しいアパートから駅までどのくらいの距離か、私に教えてください。	Please tell me ( ) from your new apartment to the station.	how far it is	how long is it	how far is it	how far is it	how long it is	4択	<慶應義塾大>
450	16	115	寝る所がない人もいるのですよね。	Some people don't have any place to sleep, ( ) they?	do	are	do	don't	will	4択	<山梨大>
451	16	115	学生たちはみんな、その講義がわかったのですね。	All the students understood the lecture, ( )?	didn't they	didn't they	do they	don't they	weren't they	4択	<京都産大>
452	16	115	彼は、そのパーティーに来るという約束を守ったのですよね。	He has kept his promise to come to the party, ( )?	hasn't he	hasn't he	didn't he	did he	has he	4択	<佛教大>
453	16	115	ご家族の皆さんによろしくお伝えくださいね。	Please say hello to your family for me, ( ) you?	will	do	don't	will	have	4択	<西南学院大>
454	16	115	イタリア料理店でランチを食べようよ。	Let's have lunch at the Italian restaurant, ( )?	shall we	don't you	will we	will you	shall we	4択	<大学>
455	16	116	「お国はどちらですか」「ああ、私はイギリス人です」	Where ( ) you come from? "Oh, I'm English."	do	did	have	do	are	4択	<上智大>
459	16	116	どうして奥さんを連れてこなかったの?	How come ( ) bring your wife?	you didn't	did you	did you not	didn't you	you didn't	4択	<宮崎大>
462	16	116	「こんな雨の日にしてみようという気にさせるものは何もないね」「映画を見に行きましょうよ」	“There's nothing interesting to do on rainy days like this.” “Why ( ) we go to the movies?"	don't	do	did	didn't	don't	4択	<麗澤大>
466	16	118	今までこんなにおもしろい小説は読んだことがない。	Never ( ) such an interesting novel.	have I read	have I read	have read I	I have read	read I have	4択	<日本大>
467	16	118	私の人生で、今日よりも忙しかった日はない。	At ( ) time in my life have I been busier than I am today.	no	any	no	other	some	4択	<東北学院大>
468	16	118	私が前回エリザベスに会ったとき、彼女は疲れていただけでなく、病気でもあった。	Not only ( ) also sick when I met her last time.	was Elizabeth tired but she was	Elizabeth was tired but she was	Elizabeth was tired but was she	was Elizabeth tired but she was	was Elizabeth tired but was she	4択	<福岡大>
469	16	118	火星から持ち帰った物質を詳細に再検査して初めて、NASA の研究者たちは水流の痕跡かもしれないものを発見した。	Only after a close re-examination of the material from Mars ( ) possible water flows.	did the research staff at NASA discover	did the research staff at NASA discover	the research staff at NASA did discover	the research staff at NASA discovered	was the research staff at NASA discovered	4択	<慶應義塾大>
471	16	119	「ピーターは6時までには準備できていないだろう」「メアリーもそうだろう」	Peter won't be ready by six. "( )"	Neither will Mary.	So will Mary.	Neither will Mary.	So won't Mary.	Mary will too.	4択	<青山学院大>
472	16	119	ビルはまだ、あまりお金が貯まっていない。また、彼の兄も貯まっていない。	Bill has not saved much money yet. ( ) has his brother.	Nor	So	Or	Either	Nor	4択	<名古屋学院大>
474	16	120	彼女はとても頭のいい生徒だったので、先生たちはみな彼女に感心した。	She was ( ) student that all the teachers admired her.	so bright a	so bright	so bright a	too bright	too bright a	4択	<明治学院大>
476	16	120	これほど面白い本をこれまで読んだことがない。	I have never read (such an interesting book).		such an interesting book	such interesting a book	a such interesting book	such a book interesting	4択	<産能大>
477	16	121	彼女はおもちゃを床一面に散らかしっぱなしにするので、私がそれらを拾わなければならない。	She leaves her toys all over the floor and I have to pick ( ).	them up	them up	themselves up	up them	up themselves	4択	<センター試験>
478	16	121	どんなにみすぼらしくとも、わが家にまさる場所はない。	( ) it ever so humble, there is no place like home.	Be	Be	Have	Let	Make	4択	<四天王寺大>
481	16	122	「ご両親は高いところは苦手ですか」「2人とも、というわけではありません。 父は、仕事でよく飛行機に乗ります」	“Are your parents afraid of heights?” “Not ( ); my father often flies in airplanes on business."	both	either	any	all	both	4択	<芝浦工大>
482	16	122	安いものが必ずしも経済的なわけではない。	Cheap things are not ( ) economical.	always	always	neither	hardly	scarcely	4択	<玉川大>
483	16	123	生徒たちは、その講義をまったく理解できなかった。	The students did not understand that lecture in the ( ).	least	least	less	little	few	4択	<中京大>
485	16	123	私は、彼の能力に関してはまったく疑いを持っていない。	I have no doubt ( ) about his ability.	whatever	nothing	quite	whatever	least	4択	<西南学院大>
486	16	123	短期滞在では、カナダは入国ビザを取ることを必要としないし、アメリカ合衆国も必要としない。	For short stays, Canada does not require that we obtain visas to enter the country, and ( ).	the U.S. doesn't, either	neither the U.S. does	the U.S. does neither	the U.S. doesn't, either	the U.S. doesn't, too	4択	<慶應義塾大>
488	16	124	首相は長い演説を行ったが、言いたいことはまったく明瞭ではなかった。	The prime minister made a long speech, but the message was ( ) but clear.	anything	anything	everything	nothing	something	4択	<武蔵大>
490	16	124	その新しい理論はまだ証明されていない。	The new theory has ( ) to be proved.	yet	already	become	been	yet	4択	<聖学院大>
491	16	124	その手術が成功したかどうかはまだわからない。	It ( ) to be seen whether or not the operation was successful.	remains	proves	stays	turns	remains	4択	<西南学院大>
494	16	125	2度あることは3度ある。	It never rains ( ) it pours.	but	when	that	as	but	4択	<武庫川女子大>
495	16	126	肺ガンは、発見が早ければ治療できる。	Lung cancer can be cured if ( ) in time.	discovered	discover	to discover	discovered	discovering	4択	<福井工大>
496	16	126	データが回復する見込みは、たとえあるにしても、 ほとんどない。	There is little, ( ), hope of recovering the data.	if any	if any	if ever	if only	if some	4択	<西南学院大>
497	16	126	私は、たとえあるにしても、めったに北海道の故郷に帰ることはない。	I seldom, ( ), go to my hometown in Hokkaido.	if ever	if any	if ever	if never	if rarely	4択	<東京薬大>
498	16	126	ジョンは悪い子ではありません。 どちらかといえば、彼はかなり良い子です。	John isn't a bad boy. If ( ), he's a pretty good one.	anything	anybody	anything	nobody	nothing	4択	<専修大>
499	16	126	あなたは1か月とは言わないまでも、少なくとも1週間はここに滞在すべきです。	You should stay here at least a week, ( ) a month.	if not	if not	as well as	as long as	even if	4択	<名古屋学院大>
500	16	127	私にその本を送ったのはジャックでしたか。	Was ( ) Jack that sent me the book?	it	he	it	who	him	4択	<日本工大>
501	16	127	彼女の手紙を読んで初めて、私は何が起きているのかわかった。	It was only when I read her letter ( ) I realized what was happening.	that	how	that	why	which	4択	<大阪大谷大>
505	16	128	彼女はあまりしゃべらないが、いったん話をすれば雄弁である。	She doesn't talk much, but once she ( ) speak she is eloquent.	does	has	had	does	did	4択	<城西大>