No	Chapter	Point	Question_JP	Question_EN	Answer	Choices1	Choices2	Choices3	Choices4	Type	Source
182	8	57	このポールは、向こうのあのポールの2倍の長さがある。	This pole is ( ) that one over there.	twice the length of	twice longer	double long of	twice the length of	twice long to	4択書換	<日本工大>
185	8	58	エネルギー問題は、経済問題というよりは環境問題である。	Energy issues are not ( ) economic problems as environmental problems.	so much	very much	so much	so little	so many	4択	<西南学院大>
186	8	58	彼女のものぐさな夫は、自分の皿を洗うことさえしない。	Her lazy husband does not so ( ) as wash his own dishes.	much	even	much	far	little	4択	<九州産大>
187	8	58	彼は歴史上、並外れた偉大な学者である。	He is as great a scholar ( ).	as ever lived	as ever lived	than has ever lived	who never lived	as has never lived	4択	<工学院大>
188	8	59	こっちのを飼おうとよ。ずっと安いよ。	Let's buy this one. It's ( ) cheaper.	much	much	very	too	more	4択	<駒澤大>
190	8	59	彼は利口というより賢明だ。	He is ( ) than clever.	wiser	more wise	wiser	wise	the most wise	4択	<愛知淑徳大>
191	8	59	彼女は、2冊の本のうち安い方を買った。	She bought ( ) of the two books.	the cheaper	cheapest	the cheaper	cheaper	the cheapest	4択	<亜細亜大>
192	8	60	そのことについて考えれば考えるほど、私はますますジキルはおかしいと確信するようになった。	The more I thought about it, ( ) certain I became that Jekyll was mad.	the more	even more	the more	mostly	it was almost	4択	<長岡造形大>
194	8	60	彼女は、彼の性格のためによりいっそう彼を愛していると言う。	She says she loves him all ( ) for his character.	the more	more	less	the more	the most	4択	<防衛大学校>
195	8	60	よい物語は、2度語られたからといって少しも悪くはならない。	A good tale is none the ( ) for being twice told.	worse	least	worse	excellence	good	4択	<青山学院大>
196	8	60	どんなに聡明なチンパンジーであっても話すことができないのは、彼らが飛ぶことができないのと同じである。	Even the brightest of chimpanzees can no( ) speak than they can fly.	more	less	least	more	most	4択	<東京薬大>
197	8	60	仕事が人生の唯一の目的ではないのは、遊びがそうでないのと同じである。	Work is not the only object in life ( ) play is.	any more than	any more than	more or less than	more than	no less than	4択	<明治学院大>
199	8	60	新聞によると、先月は百万人もの客がその美術館を訪れたそうだ。	According to the newspaper, ( ) one million people visited the museum last month.	no less than	no less	no less than	no more	not any more	4択	<近畿大>
200	8	60	彼がたくさん本を持っているのに、私はびっくりした。 彼の書斎には少なくとも5、000冊の本があった。	There were ( ) five thousand books in his library.	not less than	not more than	not less than	no more than	at most	4択	<皇學館大>
203	8	61	もちろん彼はとてもすばらしい書き手ですが、学者と言うよりもジャーナリストです。	Of course he is quite a good writer, but he is a journalist ( ) than a scholar.	rather	better	either	further	rather	4択	<京都産大>
205	8	61	私は彼女と話をしたことさえないし、ましてやあなたの個人的な問題を彼女と議論したこともない。	I did not even speak to her, ( ) discuss your personal problems with her.	much less	much less	still more	much more	less than	4択	<昭和女子大>
208	8	62	ほとんどの子どもが勉強よりも遊びを好む。	Most children prefer playing ( ) studying.	to	than	to	for	in	4択	<札幌大>
209	9	63	3人の姉妹の中で、ジェーンが最も歌がうまかった。	Of the three sisters, Jane was ( ) singer.	the best	the better	a better	the best	a best	4択	<獨協大>
210	9	63	この映画は、 すべての中でずば抜けておもしろい。	This movie is ( ) far the most interesting of all.	by	too	by	much	very	4択	<東海大>
211	9	63	スーザンは、クラスの中でずば抜けてすぐれた学生です。	Susan is ( ) student in her class.	much the best	much best	much the best	the much best	very the best	4択	<学習院女子大>
212	9	63	これは、私がこれまで見てきた中で最も美しい景色である。	This is ( ) beautiful scene I've ever seen.	the most	much more	much less	prettier than	the most	4択	<岩手医科大>
214	9	63	ロサンゼルスは合衆国で2番目に大きな都市だ。	Los Angeles is ( ) city in the United States.	the second largest	the second largest	the largest next	the second larger	the next larger	4択	<専修大>
215	9	63	ロールス・ロイスは、世界で最も高価な車の一つです。	A Rolls-Royce is one ( ) in the world.	of the most expensive cars	of the most expensive car	of the most expensive cars	of more expensive car	of more expensive cars	4択	<拓殖大>
216	9	63	もうすぐ2時なので、私たちにはせいぜい10分しか残されていない。	It's almost two o'clock so we have only ten more minutes ( ).	at most	at first	at last	at least	at most	4択	<センター試験>
217	9	64	トムはクラスのほかのどの生徒よりも背が高い。	Tom is taller than ( ) in the class.	any other student	any other student	other any student	the other students	any other students	4択	<近畿大>
220	9	64	友情は子どもにとって最も大切である。	( ) is as important to a child as friendship.	Nothing	Anybody	Anytime	Nothing	Somebody	4択書換	<近畿大>
221	9	65	「クマを見たことがある?」「ええ、3年前に上野動物園で見たわ」	Have you ever seen a bear? "Yes, I saw ( ) in Ueno Zoo three years ago."	one	it	that	one	him	4択	<東洋大>
222	9	65	もしジェーンがそのお金を必要としているのなら、それを貸しましょう。	I will lend Jane the money if she needs ( ).	it	one	it	the one	so	4択	<関西外大>
223	9	65	「どんな腕時計を買ったらいいでしょうか」「日本製を買いなさい」	What kind of watch shall I buy? "Get ( )."	a Japanese one	one Swiss	French one	a Japanese one	American watch	4択	<東海大>
224	9	65	「この新しい辞書で単語を調べるのは大変だよ」「それなら、前に使っていたものを使ったらどう?」	It's hard to look up words in this new dictionary. "Then why don't you use ( ) you were using before?"	the one	a one	it	one another	the one	4択	<共立女子大>
225	9	65	ヨシコは白ワインより赤ワインが好きだ。	Yoshiko likes red wine better than ( ).	white	a white one	white one	white	the white one	4択	<園田学園女子大>
226	9	65	これらのシャツは高すぎます。 もっと安いものを見せてもらえますか。	These shirts are too expensive. May I see some cheaper ( )?	ones	ones	one	any	other	4択	<拓殖大>
227	9	66	その新しいデザインは、古いデザインよりもさらに上品です。	The new designs are more elegant than the old ( ).	ones	it	that	ones	them	4択	<拓殖大>
228	9	66	東京の人口は大阪の人口よりも多い。	The population of Tokyo is larger than ( ) of Osaka.	that	those	which	one	that	4択	<東京経大>
230	9	66	他の国から輸入された車はその国で生産されたものよりもずっといい。	Cars imported from other countries are a lot better than ( ) made in the country.	those	all	them	those	which	4択	<立教大>
232	9	66	会議に出席していた人たちは、 その計画を支持した。	( ) present at the meeting supported the plan.	Those	They	That	Who	Those	4択	<岩手医科大>
233	9	66	アメリカ人は、質問に対して正直で誠実な答えを期待しているし、 また答えをそういうものとして受けとめるだろう。	Americans expect honest, sincere answers to their questions, and they will take answers as ( ).	such	it	so	such	well	4択	<中部大>
237	10	68	彼は自分専用のコンピュータを持っていなかったので、彼らは自分たちのコンピュータを彼に貸してあげた。	He didn't have a computer of his own, so they let him borrow ( ).	theirs	their	theirs	them	themselves	4択	<武蔵大>
238	10	68	私のこの古いカメラは、父からのプレゼントでした。	( ) was a present from my father.	This old camera of mine	My old camera of this	My old this camera	This my old camera	This old camera of mine	4択	<センター試験>
239	10	69	昨晩ケンと私は外食したかったのだが、二人とも十分なお金の持ち合わせがなかった。	Although Ken and I wanted to eat out last night, ( ) of us had enough money.	neither	either	neither	no one	no	4択	<東海大>
240	10	69	「これらの帽子のどちらかをいかがですか」「ありがとう。 でもどちらもほしくありません」	Would you like either of these hats? "No, I don't want ( ), thanks."	either	both	either	neither	none of these	4択	<湘南工科大>
241	10	69	この通りの両側にはたくさんのお店がある。	There are many shops on ( ) side of the road.	either	any	another	either	both	4択	<京都産大>
242	10	69	運がよかったことに、昨日は3人の児童のうち誰もケガをしなかった。	Fortunately, ( ) of the three school children were hurt yesterday.	none	either	neither	nobody	none	4択	<立命館大>
243	10	69	ケーキがほしかったが、まったく残っていなかった。	I wanted some cake, but there was ( ) left.	none	none	no	any	much	4択	<駒澤大>
244	10	70	これら4人の学生は、それぞれ作文を書いた。	( ) of these four students has written an essay.	Each	Both	Every	Each	Some	4択	<姫路獨協大>
245	10	70	今度の月曜日に、 彼の両親が岐阜に来ることになっている。	( ) parents will come to Gifu next Monday.	Both his	His both	Both his	His both of	Both his of	4択	<岐阜聖徳学園大>
246	10	70	これらのバスのどれにでも乗ることができます。 みんな都心に行きます。	You can catch ( ) of these buses. They all go to the city center.	any	any	every	most	some	4択	<久留米大>
247	10	70	トムとメアリーは共通の友人を通じておたがいに知り合いになった。	Tom and Mary became ( ) through mutual friends.	acquainted with each other	acquainted each other	acquainted themselves	acquainted with	acquainted with each other	4択	<日本大>
248	10	70	「もしその賞金をもらったら、 そのお金で何をする、ジュリー?」「世界中のすべての国に行ってみたいわ」	If you won the prize, what would you do with the money, Julie? "I would like to visit ( ) in the world."	every country	every country	all country	every countries	every places	4択	<大妻女子大>
250	10	70	スーザンは、月・水・金と、平日の1日おきにピアノの個人レッスンを受けています。	Susan has a private piano lesson ( ) weekday: Monday, Wednesday, Friday.	every other	every one	every other	every third	day after	4択	<名古屋女子大>
251	11	71	「キャシーと彼女のお姉さん[妹さん]はとても似てるね」「ええ、私は2人を区別できないわ」	Kathy and her sister are so alike. "Yes, I can't tell one from ( )."	the other	another	other	others	the other	4択	<センター試験>
252	11	71	この車を売って、別の車を買うつもりです。	I'm going to sell this car and get ( ) one.	another	another	new	different	other	4択	<桃山学院大>
253	11	71	私には3人の息子がいますが、1人はシカゴに住んでおり、 あとはニューヨークに住んでいます。	I have three sons; one lives in Chicago and ( ) live in New York.	the others	other	others	another	the others	4択	<姫路獨協大>
254	11	71	バレーボールが好きなクラスメートもいれば、テニスを楽しむクラスメートもいる。	Some of my classmates like volleyball and ( ) enjoy tennis.	others	another	other	others	the other	4択	<玉川大>
256	11	71	乗客が続々とやって来た。	Passengers came in one after ( ).	another	another	one	others	two	4択	<姫路獨協大>
257	11	71	もしそれを買いたいのなら、あと10ドル支払う必要があります。	If you want to get it, you'll have to pay ( ) ten dollars.	another	another	other	others	the another	4択	<国士舘大>
258	11	71	彼には人の気持ちがわからない。	He doesn't understand the feelings of ( ).	others	other	others	peoples	another	4択	<流通科学大>
259	11	72	彼は私が尋ねるほとんどの質問に答えることができるほど頭がいい。	He is smart enough to be able to answer ( ) questions I ask him.	most of the	almost	almost of	all most	most of the	4択	<東京経大>
260	11	72	今日は、ほとんどすべての座席が予約済みです。	( ) the seats are reserved today.	Almost all of	Almost all of	Almost of	Almost	The most of	4択	<同志社大>
261	11	72	ほとんどすべての日本人は、お米を食べるのが好きです。	( ) Japanese like to eat rice.	Most	Almost all	Most of	Almost	Almost of	4択	<拓殖大>
262	11	73	「図書館は、土曜日は開館していますか」「開館していると思います」	Will the library be open on Saturday? "( )"	I suppose so.	To get some books.	I love to read.	I suppose so.	Not many people.	4択	<九州国際大>
263	11	73	そうしたのはあまり賢いことではなかったね。 たぶんね。	That wasn't a very wise thing to do, was it? I ( ).	suppose not	don't suppose	don't suppose it	suppose it not	suppose not	4択	<青山学院大>
264	11	74	警察官はその犯罪について彼に尋ねたが、彼の母親は、彼はそれには何も関係していないと言った。	The policeman asked him about the crime but his mother said he had ( ) to do with it.	nothing	nobody	anything	anybody	nothing	4択	<中央大>
265	11	74	私は、その本を無料で手に入れました。	I got the book for nothing.	free of charge	free of charge	for a charge	at a charge	with a charge	4択	<関西外大>
267	11	75	パーティーはすばらしかった。 私たちは大いに楽しんだ。	The party was great. We enjoyed ( ) very much.	ourselves	us	with us	ourselves	by ourselves	4択	<九州産大>
268	11	75	テーブルの上のケーキを自由に取って食べてください。	Please help ( ) to some of the cakes on the table.	yourself	myself	itself	yourself	ourselves	4択	<札幌学院大>
269	11	75	私たちの家で1か月間、過ごすことになるのだから、くつろいでください。	You'll be staying with us for a month, so just ( ) at home.	make yourself	you're supposed	you're leaving	make yourself	get used to	4択	<福井工大>
270	11	75	兄 [弟] が研究のために外国に行って以来、私はひとりで暮らしている。	I've been living ( ) myself since my brother went abroad to do research.	by	from	at	into	by	4択	<早稲田大>
271	11	75	ここだけの話だが、 実のところ、 今夜はむしろ家にいたいのだ。	( ) ourselves, I'd actually rather stay home tonight.	Between	As	With	From	Between	4択	<明治大>
272	11	75	彼は怒りでわれを忘れた。	He was beside himself with rage.	very angry	a bit angry	a bit relieved	very relieved	very angry	4択	<立命館大>
274	12	76	先生はスペリングで間違いをおかした数人の学生に、授業の後、残るように伝えた。	The teacher told some students ( ) made mistakes in their spelling to remain after class.	who	which	who	whom	whose	4択	<京都光華女子大>
275	12	76	彼女は、よく理解することが難しい少女だ。	She is a girl ( ) it is difficult to get to know well.	whom	as	whose	what	whom	4択	<千葉工大>
276	12	76	私たちは、19世紀の産業革命に匹敵するであろう、また別の大変革に近づきつつある。	We are approaching another revolution ( ) will rival the Industrial Revolution of the 19th century.	which	which	what	who	it	4択	<中央大>
278	12	76	仕事が患者を手術することである医者は、外科医と呼ばれる。	A doctor ( ) job is operating on patients is called a surgeon.	whose	who	whose	whom	that	4択	<佛教大>
279	12	76	「そのてっぺんが天までとどく塔を建てよう」 と彼らは言った。	They said, "Let's build a tower ( ) top will reach up to heaven."	whose	which	whose	whom	that	4択	<京都学園大>
281	12	77	彼女には自慢の賢い息子がいる。	She has a clever son ( ).	(不適切) of that she is proud	of whom she is proud	she is proud of	of that she is proud	that she is proud of	4択不適	<東京国際大>
283	12	77	これらは、彼が自分自身の家を建てるのに使った道具である。	These are the tools ( ) he built his own house.	with which	which	that	with which	with that	4択	<青山学院大>
284	12	78	ここはかつてモーツァルトが夕食後に散歩をしていた公園です。	This is the park ( ) Mozart used to take a walk after dinner.	where	that	where	which	why	4択	<京都産大>
285	12	78	昨年の夏にあなたが登った山は、日本で2番目に高い山です。	The mountain ( ) you climbed last summer is the second highest mountain in Japan.	which	what	whom	which	where	4択	<亜細亜大>
286	12	78	むごい戦争が終結するときが間もなくやってくるだろう。	The time will soon come ( ) the cruel war will end.	when	when	what	why	how	4択	<名古屋学院大>
287	12	78	彼女の要求に同意すべきではない理由がいくつかある。	There are several reasons ( ) we should not agree to her request.	why	how	where	which	why	4択	<京都学園大>
292	12	79	私は、日本で2番目に大きな都市である横浜の郊外に住んでいる。	I live in the suburbs of Yokohama, ( ) is Japan's second largest city.	which	where	that	what	which	4択	<名城大>
293	12	79	その新聞社で働いた結果として、 私は未来の夫に出会ったが、彼もやはりそこで働いていたのだった。	As a result of working at the newspaper, I met my future husband, ( ) was also working there.	who	when	which	that	who	4択	<四天王寺大>
294	12	79	この前の冬、私は香港に出かけたが、そこは私が思っていたほど暖かくはなかった。	Last winter I went to Hong Kong, ( ) as warm as I had expected.	where it wasn't	when wasn't	where it wasn't	where wasn't	which it wasn't	4択	<センター試験>
295	12	79	彼女には3人の息子がいたが、全員が医者になった。	She had three sons, all ( ) became doctors.	of whom	of whom	which	who	of which	4択	<東海大>
296	12	79	彼は私に本を2冊貸してくれたが、私はそのどちらも読んでいない。	He lent me two books, neither of ( ) I have read.	which	that	which	what	them	4択	<和洋女子大>
297	12	80	交通渋滞に巻き込まれてしまい、それで私たちは会議に40分遅れてしまった。	We got stuck in a traffic jam, ( ) made us forty minutes late for the meeting.	which	which	that	it	as	4択	<東邦大>
298	12	80	私はその問題を解こうとしたが、それは時間のむだだとわかった。	I tried to solve the problem, ( ) I found a waste of time.	which	what	which	that	when	4択	<和洋女子大>
299	12	80	風呂に入るように言われ、私はその勧めに従った。	I was told to take a bath, ( ) advice I followed.	which	which	whose	its	what	4択	<実践女子大>
300	12	81	最初は易しいと思えることが、後になって難しいとわかることがしばしばある。	( ) seems easy at first often turns out to be difficult.	What	It	That	What	Which	4択	<國學院大>
301	12	81	彼は、稼いだ分を自分の息子のために使う。	He spends ( ) he earns on his son.	what	as	but	that	what	4択	<中部大>
303	12	81	メアリーは、少ないながら持っていたすべてのお金をなくした。	Mary lost ( ) little money she had.	what	which	whose	how	what	4択	<東京家政大>
304	12	82	現在のジャックがあるのは、妻の援助のおかげである。	Jack owes ( ) he is to the support of his wife.	what	as	that	what	which	4択	<京都産大>
308	12	82	あたりはだんだん暗くなり、さらに悪いことに、私たちはホテルを見つけることができなかった。	It was getting dark, and ( ) was worse, we couldn't find our hotel.	what	which	that	what	but	4択	<立命館大>
309	12	82	あなたはそれを覚えておくべきだし、さらには、それをきちんと理解すべきです。	You should remember it, and ( ), you should get it right.	what's more	nevertheless	what's more	however	on time	4択	<大妻女子大>
310	12	83	その地位は、彼女が申し分なく有能だと考えていた男性によって占められた。	The position was filled by a man ( ) she thought was thoroughly competent.	whom	of which	who	whose	whom	4択	<東北学院大>
311	12	83	あなたは、正しいと思うことをしていますか。	Are you doing what ( )?	you think is right	you think you are right	you think it is right	you think is right	it is you think right	4択	<日本工大>
315	13	84	(a) は誰にでも、弱点がある。 (b) 弱点のない人はいない。	(b) There is no one ( ) has weaknesses.	but	but	who	that	than	4択書換	<関西学院大>
317	13	85	デレクは、外国語を習得するのに理想的な環境を見つけた。	Derek found an ideal environment ( ).	in which to learn foreign languages	in which foreign languages to be learned	in which to learn foreign languages	learning foreign languages in	which to learn foreign languages in	4択	<慶應義塾大>
321	13	86	キノシタさんが親切にしているのは、彼女の友人たちだけではありません。 彼女は、助けを必要としている人は誰でも助けます。	She helps ( ) needs her help.	whoever	those	whatever	whoever	whom	4択	<センター試験>
322	13	86	どちらの政党が政権に就こうとも、イギリスの外交政策は同じままですか。	Does British foreign policy remain the same, ( ) party is in power?	whichever	whoever	however	whichever	wherever	4択	<立命館大>
323	13	87	私は君がどこに行こうともついていくつもりだ。	I will go with you ( ) you go.	wherever	whatever	wherever	whichever	whoever	4択	(記載なし)
325	13	87	どんなに忙しくても、必ず少なくとも6時間は睡眠をとりなさい。	( ) busy you are, never fail to sleep at least six hours.	However	However	Whoever	Whatever	Whenever	4択	<関東学院大>
326	13	87	どんなに難しくても、新しいコンピュータの操作に習熟しなければならない。	( ) difficult it may be, you have to master the operation of the new computer.	No matter how	No matter however	No matter how	No how	No matter	4択	<専修大>
327	14	88	ジムの日本語はあまり上手ではなかったが、それでも彼のスピーチは聴衆に感銘を与えた。	Jim's Japanese was not very good, ( ) his speech still impressed the audience.	but	because	but	so	therefore	4択	<京都産大>
328	14	88	私はフランス語を話せませんし、読むこともできません。	I can't speak French, ( ) can I read it.	nor	but	also	nor	although	4択	<千葉工大>
329	14	88	なじみのある町ではなかったが、どうにかホテルに着いた。	I was not familiar with the town, ( ) I managed to get to the hotel.	yet	already	so	then	yet	4択	<藤女子大>
331	14	88	(a)もっと一生懸命勉強すれば、あなたは試験に合格するだろう。　(b)もっと一生懸命勉強しなさい、そうすればあなたは試験に合格するだろう。	(a) If you study harder, you will pass the examination. (b) Study harder, (and) you will pass the examination.	and	and	or	but	if	4択書換	<朝日大>
333	14	89	彼は学者ではなく、作家です。	He is not a scholar ( ) a writer.	but	and	also	but	than	4択	<岐阜聖徳学園大>
334	14	89	この本は、あの本よりもためになるだけでなくおもしろい。	This book is not only more instructive ( ) more interesting than that book.	but	that	or	nor	but	4択	<関東学院大>
335	14	89	スポーツアリーナに行くにはバスか電車のどちらでも利用できますよ。	To get to the sports arena, you can take ( ) the bus or the train.	either	either	neither	both	nor	4択	<東海大>
336	14	89	父も兄もタバコを吸いません。	( ) my father nor my brother smokes.	Neither	Either	Both	Neither	Not only	4択	(記載なし)
337	14	90	腐っていることを知るために、腐った卵を全部食べる必要があるのかい?	Do you have to eat the whole of a bad egg to know ( ) it is bad?	that	when	that	what	which	4択	<芝浦工大>
338	14	90	私はかつてカリフォルニアがメキシコ領だったという事実を信じることができなかった。	I could not believe the fact ( ) California used to belong to Mexico.	that	why	how	that	which	4択	<日本女子大>
339	14	90	私たちがクリスマスに間に合うように終わらせられるかどうか、私には疑わしい。	I doubt ( ) we'll finish in time for Christmas.	if	how	if	when	why	4択	<中部大>
340	14	90	タバコをやめるべきかどうかは、あなたが下さなければならない最大の決断です。	( ) you should stop smoking is the biggest decision you have to make.	Whether	If	Unless	While	Whether	4択	<学習院女子大>
